{
  "$schema": "../schemas/source-manifest.schema.json",
  "schema_version": "1.0.0",
  "source_id": "shs-legacy",
  "status": "acquired",
  "owner": "Cologne Digital Sanskrit Dictionaries",
  "language": "san",
  "family": "Indo-European/Indo-Aryan",
  "url": "https://github.com/sanskrit-lexicon/csl-orig",
  "revision": { "kind": "release", "value": "repository-snapshot-1920f557" },
  "retrieval_date": "2018-01-17",
  "sha256": "7ef1276422c43bb1e0041aaeaa8cbb4c7e6d30a655dd11434160e9ee71e10f6d",
  "license": "NOASSERTION",
  "license_status": "unverified",
  "distribution_policy": "vendored",
  "usage_policy": "unverified",
  "optional": false,
  "default_bundle": false,
  "citation": "Shabda-Sagara Sanskrit dictionary digitization; repository snapshot first recorded in commit 1920f557. Redistribution terms for this exact snapshot require verification.",
  "parser": { "id": "shabda-sagara", "version": "legacy-1" },
  "raw_path": "resources/lexicons/shstxt/shs.txt",
  "generated_artifact_path": null,
  "filters": {
    "include": ["all records in the vendored snapshot"],
    "exclude": ["none during acquisition; runtime parser exclusions are not yet normalized"]
  }
}
