{
  "$schema": "../../resources/lexicons/schemas/source-manifest.schema.json",
  "schema_version": "1.0.0",
  "source_id": "synthetic-target",
  "status": "acquired",
  "owner": "Enochian test suite",
  "language": "tar",
  "family": "target",
  "url": "https://example.invalid/enochian/synthetic-target",
  "revision": { "kind": "release", "value": "synthetic-1.0.0" },
  "retrieval_date": "2026-08-21",
  "sha256": "f4d0c8d1bce878961030ab1576c2ba33293c09ec852483dd8f8c39347c55ff7b",
  "license": "MIT",
  "license_status": "verified",
  "distribution_policy": "vendored",
  "usage_policy": "unrestricted",
  "optional": false,
  "default_bundle": true,
  "citation": "Synthetic target lexicon generated for the Enochian smoke profile.",
  "parser": { "id": "synthetic-jsonl", "version": "1.0.0" },
  "raw_path": "experiments/synthetic-smoke/target.jsonl",
  "generated_artifact_path": "experiments/synthetic-smoke/target.jsonl",
  "filters": { "include": ["lemma entries"], "exclude": [] }
}
