{
  "$schema": "../schemas/source-manifest.schema.json",
  "schema_version": "1.0.0",
  "source_id": "romlex",
  "status": "acquired",
  "owner": "University of Graz RomLex project",
  "language": "rom",
  "family": "Indo-European/Indo-Aryan/Romani",
  "url": "https://romlex.uni-graz.at/",
  "revision": { "kind": "release", "value": "scrape-2017-09-09" },
  "retrieval_date": "2017-09-09",
  "sha256": "c1de1d62b51b6a1d822857ec7341e5c4a13b3d741974f9dbfe8700eb99dde8f3",
  "license": "NOASSERTION",
  "license_status": "unverified",
  "distribution_policy": "vendored",
  "usage_policy": "unverified",
  "optional": false,
  "default_bundle": false,
  "citation": "RomLex lexical database, University of Graz; snapshot generated by the Enochian scraper on 2017-09-09. Redistribution terms require verification.",
  "parser": { "id": "romlex-json", "version": "legacy-1" },
  "raw_path": "resources/lexicons/romlex/romlex.json",
  "generated_artifact_path": null,
  "filters": {
    "include": ["all dialect records returned by the RomLex web interface"],
    "exclude": ["none during acquisition"]
  }
}
