{
  "$schema": "../schemas/source-manifest.schema.json",
  "schema_version": "1.0.0",
  "source_id": "bhsa",
  "status": "acquired",
  "owner": "ETCBC, Vrije Universiteit Amsterdam",
  "language": "hbo",
  "family": "Afro-Asiatic/Semitic",
  "url": "https://github.com/ETCBC/bhsa/releases/download/v1.8.1/complete.zip",
  "revision": { "kind": "release", "value": "v1.8.1 (b112c161cfd21eae403d51a2733740d8743460e7), TF 2021" },
  "retrieval_date": "2026-08-18",
  "sha256": "8104fae1151c926cfcfd01f7e8a30a09af8c607546f14482990833b624b73168",
  "license": "CC-BY-NC-4.0",
  "license_status": "verified",
  "distribution_policy": "metadata-only",
  "usage_policy": "non-commercial",
  "optional": true,
  "default_bundle": false,
  "citation": "ETCBC, Biblia Hebraica Stuttgartensia Amstelodamensis, release v1.8.1, Text-Fabric 2021; DOI 10.17026/dans-z6y-skyh.",
  "parser": { "id": "text-fabric-bhsa", "version": "1.0.0" },
  "raw_path": ".enoch/bhsa/complete.zip",
  "generated_artifact_path": ".enoch/bhsa-generated/bhsa.jsonl",
  "filters": {
    "include": ["unique Biblical Hebrew lexemes from an explicitly authorized local BHSA snapshot", "ETCBC phono v2.1 TF-2021 readings when locally supplied"],
    "exclude": ["Aramaic lexemes", "records without a vocalized form or phonological reading", "all BHSA data from default acquisition, packaging, and redistribution"]
  }
}
