{
  "$schema": "../../resources/lexicons/schemas/source-manifest.schema.json",
  "schema_version": "1.0.0",
  "source_id": "synthetic-control",
  "status": "acquired",
  "owner": "Enochian test suite",
  "language": "ctl",
  "family": "control",
  "url": "https://example.invalid/enochian/synthetic-control",
  "revision": { "kind": "release", "value": "synthetic-1.0.0" },
  "retrieval_date": "2026-08-21",
  "sha256": "2af8c44a97b12701a074e2ba2f86dde43e404fabfe62e530f8da65a613cacdf7",
  "license": "MIT",
  "license_status": "verified",
  "distribution_policy": "vendored",
  "usage_policy": "unrestricted",
  "optional": false,
  "default_bundle": true,
  "citation": "Synthetic control lexicon generated for the Enochian smoke profile.",
  "parser": { "id": "synthetic-jsonl", "version": "1.0.0" },
  "raw_path": "experiments/synthetic-smoke/control.jsonl",
  "generated_artifact_path": "experiments/synthetic-smoke/control.jsonl",
  "filters": { "include": ["lemma entries"], "exclude": [] }
}
