{
  "$schema": "../schemas/source-manifest.schema.json",
  "schema_version": "1.0.0",
  "source_id": "cdsl-ap",
  "status": "acquired",
  "owner": "Cologne Digital Sanskrit Dictionaries",
  "language": "san",
  "family": "Indo-European/Indo-Aryan",
  "url": "https://github.com/sanskrit-lexicon/csl-orig",
  "revision": { "kind": "commit", "value": "b7297b97cf9f7112277ea98f7969291eb1d5f495" },
  "retrieval_date": "2026-08-10",
  "sha256": "1f8c4c1305e2a98dddd938ed588698f2410d4aab31c29aff8ad1200edf95846c",
  "license": "CC-BY-SA-4.0",
  "license_status": "verified",
  "distribution_policy": "download-on-demand",
  "usage_policy": "unrestricted",
  "optional": false,
  "default_bundle": false,
  "citation": "V. S. Apte, The Practical Sanskrit-English Dictionary, revised edition (1957), digitized by Cologne Digital Sanskrit Dictionaries.",
  "parser": { "id": "cdsl-orig", "version": "1.0.0" },
  "raw_path": ".enoch/csl-orig-b7297b97cf9f7112277ea98f7969291eb1d5f495/v02/ap/ap.txt",
  "generated_artifact_path": ".enoch/cdsl-generated/cdsl-ap.jsonl",
  "filters": {
    "include": ["AP records from the pinned csl-orig snapshot"],
    "exclude": ["records without a complete L/k1/k2/LEND boundary", "records whose SLP1 headword cannot be converted completely"]
  }
}
